{"$schema":"https://json-schema.org/draft/2020-12/schema","title":"GoalOS Contract Verification Evidence","type":"object","required":["network","chainId","manifestPath","manifestHash","verifiedAt","contracts","summary","claimBoundary"],"properties":{"network":{"type":"string"},"chainId":{"type":"integer"},"manifestPath":{"type":"string"},"manifestHash":{"type":"string"},"verifiedAt":{"type":"string"},"verifierToolVersions":{"type":"object"},"etherscanApiConfigured":{"type":"boolean"},"sourcifyEnabled":{"type":"boolean"},"contracts":{"type":"array"},"summary":{"type":"object","required":["totalContracts","verified","alreadyVerified","failed","partial","complete"]},"claimBoundary":{"type":"string"}},"additionalProperties":true}
