{
  "network": "ethereumSepolia",
  "chainId": 11155111,
  "manifestPath": "deployments/ethereum-sepolia.agialpha.latest.json",
  "manifestHash": "6c855d2fdb97d4e333e092b7d515d787b5bf724cc15441d9f57a410314730dbe",
  "verifiedAt": "2026-06-14T18:38:00.782Z",
  "verifierToolVersions": {
    "hardhat": "2.28.6",
    "solidity": "0.8.35"
  },
  "etherscanApiConfigured": false,
  "sourcifyEnabled": true,
  "contracts": [
    {
      "name": "AGIALPHA",
      "fqcn": "AGIALPHA",
      "address": "0x6F6f570F45833E249e27022648a26F4076F48f78",
      "bytecodePresent": "unchecked",
      "constructorArgsPresent": false,
      "alreadyVerified": false,
      "verificationUrl": null,
      "etherscanStatus": "failed",
      "sourcifyStatus": "not_run",
      "error": "Constructor args missing; manual verification args file required"
    },
    {
      "name": "CommercializationPerformanceVault",
      "fqcn": "CommercializationPerformanceVault",
      "address": "0xCA8c8688914e0F7096c920146cd0Ad85cD7Ae8b9",
      "bytecodePresent": "unchecked",
      "constructorArgsPresent": false,
      "alreadyVerified": false,
      "verificationUrl": null,
      "etherscanStatus": "failed",
      "sourcifyStatus": "not_run",
      "error": "Constructor args missing; manual verification args file required"
    },
    {
      "name": "ProofRewardsVault",
      "fqcn": "ProofRewardsVault",
      "address": "0xB0f05d25e41FbC2b52013099ED9616f1206Ae21B",
      "bytecodePresent": "unchecked",
      "constructorArgsPresent": false,
      "alreadyVerified": false,
      "verificationUrl": null,
      "etherscanStatus": "failed",
      "sourcifyStatus": "not_run",
      "error": "Constructor args missing; manual verification args file required"
    },
    {
      "name": "LiquidityVault",
      "fqcn": "LiquidityVault",
      "address": "0x5FeaeBfB4439F3516c74939A9D04e95AFE82C4ae",
      "bytecodePresent": "unchecked",
      "constructorArgsPresent": false,
      "alreadyVerified": false,
      "verificationUrl": null,
      "etherscanStatus": "failed",
      "sourcifyStatus": "not_run",
      "error": "Constructor args missing; manual verification args file required"
    },
    {
      "name": "SecurityVault",
      "fqcn": "SecurityVault",
      "address": "0x976fcd02f7C4773dd89C309fBF55D5923B4c98a1",
      "bytecodePresent": "unchecked",
      "constructorArgsPresent": false,
      "alreadyVerified": false,
      "verificationUrl": null,
      "etherscanStatus": "failed",
      "sourcifyStatus": "not_run",
      "error": "Constructor args missing; manual verification args file required"
    },
    {
      "name": "CommunityVault",
      "fqcn": "CommunityVault",
      "address": "0x19cEcCd6942ad38562Ee10bAfd44776ceB67e923",
      "bytecodePresent": "unchecked",
      "constructorArgsPresent": false,
      "alreadyVerified": false,
      "verificationUrl": null,
      "etherscanStatus": "failed",
      "sourcifyStatus": "not_run",
      "error": "Constructor args missing; manual verification args file required"
    },
    {
      "name": "ProofSeedRegistry",
      "fqcn": "ProofSeedRegistry",
      "address": "0xD42912755319665397FF090fBB63B1a31aE87Cee",
      "bytecodePresent": "unchecked",
      "constructorArgsPresent": false,
      "alreadyVerified": false,
      "verificationUrl": null,
      "etherscanStatus": "failed",
      "sourcifyStatus": "not_run",
      "error": "Constructor args missing; manual verification args file required"
    },
    {
      "name": "LegacyAGIJobManagerRegistry",
      "fqcn": "LegacyAGIJobManagerRegistry",
      "address": "0xfcDB4564c18A9134002b9771816092C9693622e3",
      "bytecodePresent": "unchecked",
      "constructorArgsPresent": false,
      "alreadyVerified": false,
      "verificationUrl": null,
      "etherscanStatus": "failed",
      "sourcifyStatus": "not_run",
      "error": "Constructor args missing; manual verification args file required"
    },
    {
      "name": "ReputationRegistry",
      "fqcn": "ReputationRegistry",
      "address": "0x927b167526bAbB9be047421db732C663a0b77B11",
      "bytecodePresent": "unchecked",
      "constructorArgsPresent": false,
      "alreadyVerified": false,
      "verificationUrl": null,
      "etherscanStatus": "failed",
      "sourcifyStatus": "not_run",
      "error": "Constructor args missing; manual verification args file required"
    },
    {
      "name": "ReferralRegistry",
      "fqcn": "ReferralRegistry",
      "address": "0x32EEce76C2C2e8758584A83Ee2F522D4788feA0f",
      "bytecodePresent": "unchecked",
      "constructorArgsPresent": false,
      "alreadyVerified": false,
      "verificationUrl": null,
      "etherscanStatus": "failed",
      "sourcifyStatus": "not_run",
      "error": "Constructor args missing; manual verification args file required"
    },
    {
      "name": "ProofCardRegistry",
      "fqcn": "ProofCardRegistry",
      "address": "0x01c1DeF3b91672704716159C9041Aeca392DdFfb",
      "bytecodePresent": "unchecked",
      "constructorArgsPresent": false,
      "alreadyVerified": false,
      "verificationUrl": null,
      "etherscanStatus": "failed",
      "sourcifyStatus": "not_run",
      "error": "Constructor args missing; manual verification args file required"
    },
    {
      "name": "ProofCredentialRegistry",
      "fqcn": "ProofCredentialRegistry",
      "address": "0x02b0B4EFd909240FCB2Eb5FAe060dC60D112E3a4",
      "bytecodePresent": "unchecked",
      "constructorArgsPresent": false,
      "alreadyVerified": false,
      "verificationUrl": null,
      "etherscanStatus": "failed",
      "sourcifyStatus": "not_run",
      "error": "Constructor args missing; manual verification args file required"
    },
    {
      "name": "JobRegistry",
      "fqcn": "JobRegistry",
      "address": "0x638A246F0Ec8883eF68280293FFE8Cfbabe61B44",
      "bytecodePresent": "unchecked",
      "constructorArgsPresent": false,
      "alreadyVerified": false,
      "verificationUrl": null,
      "etherscanStatus": "failed",
      "sourcifyStatus": "not_run",
      "error": "Constructor args missing; manual verification args file required"
    },
    {
      "name": "JobClaimBondManager",
      "fqcn": "JobClaimBondManager",
      "address": "0x6C2d83262fF84cBaDb3e416D527403135D757892",
      "bytecodePresent": "unchecked",
      "constructorArgsPresent": false,
      "alreadyVerified": false,
      "verificationUrl": null,
      "etherscanStatus": "failed",
      "sourcifyStatus": "not_run",
      "error": "Constructor args missing; manual verification args file required"
    },
    {
      "name": "PremiumAccessRegistry",
      "fqcn": "PremiumAccessRegistry",
      "address": "0xFD6F7A6a5c21A3f503EBaE7a473639974379c351",
      "bytecodePresent": "unchecked",
      "constructorArgsPresent": false,
      "alreadyVerified": false,
      "verificationUrl": null,
      "etherscanStatus": "failed",
      "sourcifyStatus": "not_run",
      "error": "Constructor args missing; manual verification args file required"
    },
    {
      "name": "ProofSubmissionRegistry",
      "fqcn": "ProofSubmissionRegistry",
      "address": "0xa6e99A4ED7498b3cdDCBB61a6A607a4925Faa1B7",
      "bytecodePresent": "unchecked",
      "constructorArgsPresent": false,
      "alreadyVerified": false,
      "verificationUrl": null,
      "etherscanStatus": "failed",
      "sourcifyStatus": "not_run",
      "error": "Constructor args missing; manual verification args file required"
    },
    {
      "name": "ReviewerBondRegistry",
      "fqcn": "ReviewerBondRegistry",
      "address": "0x5302E909d1e93e30F05B5D6Eea766363D14F9892",
      "bytecodePresent": "unchecked",
      "constructorArgsPresent": false,
      "alreadyVerified": false,
      "verificationUrl": null,
      "etherscanStatus": "failed",
      "sourcifyStatus": "not_run",
      "error": "Constructor args missing; manual verification args file required"
    },
    {
      "name": "TreasuryRouter",
      "fqcn": "TreasuryRouter",
      "address": "0x0ed64d01D0B4B655E410EF1441dD677B695639E7",
      "bytecodePresent": "unchecked",
      "constructorArgsPresent": false,
      "alreadyVerified": false,
      "verificationUrl": null,
      "etherscanStatus": "failed",
      "sourcifyStatus": "not_run",
      "error": "Constructor args missing; manual verification args file required"
    },
    {
      "name": "ProtocolConfigRegistry",
      "fqcn": "ProtocolConfigRegistry",
      "address": "0x4bf010f1b9beDA5450a8dD702ED602A104ff65EE",
      "bytecodePresent": "unchecked",
      "constructorArgsPresent": false,
      "alreadyVerified": false,
      "verificationUrl": null,
      "etherscanStatus": "failed",
      "sourcifyStatus": "not_run",
      "error": "Constructor args missing; manual verification args file required"
    },
    {
      "name": "LaunchGateRegistry",
      "fqcn": "LaunchGateRegistry",
      "address": "0x40a42Baf86Fc821f972Ad2aC878729063CeEF403",
      "bytecodePresent": "unchecked",
      "constructorArgsPresent": false,
      "alreadyVerified": false,
      "verificationUrl": null,
      "etherscanStatus": "failed",
      "sourcifyStatus": "not_run",
      "error": "Constructor args missing; manual verification args file required"
    },
    {
      "name": "DisputeRegistry",
      "fqcn": "DisputeRegistry",
      "address": "0x96F3Ce39Ad2BfDCf92C0F6E2C2CAbF83874660Fc",
      "bytecodePresent": "unchecked",
      "constructorArgsPresent": false,
      "alreadyVerified": false,
      "verificationUrl": null,
      "etherscanStatus": "failed",
      "sourcifyStatus": "not_run",
      "error": "Constructor args missing; manual verification args file required"
    },
    {
      "name": "AppealRegistry",
      "fqcn": "AppealRegistry",
      "address": "0x986aaa537b8cc170761FDAC6aC4fc7F9d8a20A8C",
      "bytecodePresent": "unchecked",
      "constructorArgsPresent": false,
      "alreadyVerified": false,
      "verificationUrl": null,
      "etherscanStatus": "failed",